{
  "package": "elizaos-plugin-coinrailz",
  "repository": "github:tdnupe3/elizaos-plugin-coinrailz",
  "kind": "plugin",
  "description": "Agent Treasury + Payments: non-custodial USDC yield on Solana (Kamino, ~3.4% APY) and Base (ERC-4626 routing via Aave/Compound/Morpho), plus 65 live x402 pay-per-call services for inference, IoT data, satellite imagery, and execution.",
  "homepage": "https://coinrailz.com",
  "version": "2.1.0",
  "tags": ["payments", "x402", "usdc", "yield", "treasury", "solana", "base", "defi", "micropayments", "iot", "satellite"]
}
