{
  "package": "@agentradar/eliza-plugin",
  "repository": "github:Bichev/agentradar-integrations",
  "kind": "plugin",
  "description": "AgentRadar trust for elizaOS — a VERIFY_AGENT action and trust provider that check a wallet/agent's on-chain trust score (ERC-8004 reputation + scam database + static analysis) before your agent interacts with or pays it.",
  "homepage": "https://github.com/Bichev/agentradar-integrations/tree/main/eliza-plugin-agentradar",
  "version": "0.1.0",
  "directory": "eliza-plugin-agentradar",
  "tags": ["trust", "verification", "x402", "erc-8004", "security", "agent-economy", "reputation"]
}
