{
  "package": "blackwall-eliza-guardrail",
  "repository": "github:bluetieroperations-create/blackwall-eliza-guardrail",
  "kind": "plugin",
  "description": "BLACK_WALL pre-action risk guardrail for elizaOS agents - wraps every action handler with a forecast() check so STOP-rated actions abort before they run; gateCall() adds per-call gating for multi-step handlers. Observe mode by default (zero behavior change).",
  "homepage": "https://github.com/bluetieroperations-create/blackwall-eliza-guardrail",
  "version": "0.2.1",
  "tags": [
    "security",
    "guardrails",
    "ai-safety",
    "risk-gate",
    "onchain-safety"
  ]
}
